{
  "schema_version": 1,
  "algorithm": "session-operation-trace",
  "source": "tacenta-spec/protocol/session-establishment.md (Keys; Publishing keys; Sending the initial message; Receiving the initial message; Replay; The replay identity); tacenta-spec/protocol/key-deletion.md (Establishing a session; Prekeys at rest; What this implementation does: one-time prekeys are replenished, a replayed last-resort handshake is refused, signed prekeys rotate); tacenta-spec/protocol/session-persistence.md (Session; Prekey store); tacenta-spec/protocol/error-handling.md (Conditions a caller must act on are named); specification-only author (related party): Jie Sun, P6 round two; ratchet.md (Sending and receiving; Skipped keys, 'A message whose ratchet key equals DHr, whose number N is below Nr, and whose key is not stored is not accepted'); mlkem-braid.md (Failure; 'Session puts nothing from a failed Braid on the wire: it refuses encrypt and decrypt with AgreementFailed'); session-persistence.md (Session, Semantic rules, 'A failed Braid (tag 11) is exempt'); session-establishment.md (Sending the initial message: 'Alice verifies every signature in the bundle and aborts if any fails'; Notation: 'Both sides refuse a Diffie-Hellman output that is not contributory'; Byte-level conventions / KEM validation, 'She has then computed no agreement and sent nothing')",
  "traces": [
    {
      "id": "prekey-store-lifecycle",
      "comment": "Family 1: create, publish, replenish, and each rotation, showing a retired key retained after the first rotation and then dropped after the second (key-deletion.md, Signed prekeys rotate).",
      "fixtures": {
        "bob-store": "the prekey store create-prekey-store below produces: create_prekeys(n=1) for Bob's identity -- signed prekey id 1, one one-time curve prekey id 2, last-resort KEM prekey id 3, one one-time KEM prekey id 4, next_id 5 (key-deletion.md, One-time prekeys are replenished)"
      },
      "steps": [
        {
          "actor": "application",
          "op": "create-prekey-store",
          "inputs": {
            "identity": "bob-identity",
            "one_time_count": "1"
          },
          "expect": {
            "outcome": "ok"
          },
          "effect": {
            "prekey_store": "created",
            "session": "unchanged",
            "next_id": "advanced"
          }
        },
        {
          "actor": "application",
          "op": "publish-bundle",
          "inputs": {
            "store": "bob-store"
          },
          "expect": {
            "outcome": "ok"
          },
          "effect": {
            "prekey_store": "unchanged",
            "session": "unchanged"
          }
        },
        {
          "actor": "application",
          "op": "replenish",
          "inputs": {
            "store": "bob-store",
            "count": "1"
          },
          "expect": {
            "outcome": "ok"
          },
          "effect": {
            "prekey_store": "replenished",
            "session": "unchanged",
            "next_id": "advanced"
          }
        },
        {
          "actor": "application",
          "op": "rotate-signed-prekey",
          "inputs": {
            "store": "bob-store"
          },
          "expect": {
            "outcome": "ok"
          },
          "effect": {
            "prekey_store": "signed-prekey-rotated",
            "session": "unchanged",
            "next_id": "advanced",
            "retired_signed_prekey": "retained"
          }
        },
        {
          "actor": "application",
          "op": "rotate-signed-prekey",
          "inputs": {
            "store": "bob-store"
          },
          "expect": {
            "outcome": "ok"
          },
          "effect": {
            "prekey_store": "signed-prekey-rotated",
            "session": "unchanged",
            "next_id": "advanced",
            "retired_signed_prekey": "dropped"
          }
        },
        {
          "actor": "application",
          "op": "rotate-kem",
          "inputs": {
            "store": "bob-store"
          },
          "expect": {
            "outcome": "ok"
          },
          "effect": {
            "prekey_store": "kem-prekey-rotated",
            "session": "unchanged",
            "next_id": "advanced",
            "retired_kem_prekey": "retained"
          }
        },
        {
          "actor": "application",
          "op": "rotate-kem",
          "inputs": {
            "store": "bob-store"
          },
          "expect": {
            "outcome": "ok"
          },
          "effect": {
            "prekey_store": "kem-prekey-rotated",
            "session": "unchanged",
            "next_id": "advanced",
            "retired_kem_prekey": "dropped"
          }
        }
      ]
    },
    {
      "id": "prekey-store-identifier-ceiling",
      "comment": "Family 1: the identifier ceiling. key-deletion.md: replenish 'adds nothing further and keeps what it has added' once next_id is u32::MAX, and each rotation 'returns without rotating, silently' at the same ceiling.",
      "fixtures": {
        "store-at-ceiling": "a prekey store whose next_id already stands at u32::MAX (key-deletion.md, One-time prekeys are replenished, identifier space end)"
      },
      "steps": [
        {
          "actor": "application",
          "op": "replenish",
          "inputs": {
            "store": "store-at-ceiling",
            "count": "1"
          },
          "expect": {
            "outcome": "ok"
          },
          "effect": {
            "prekey_store": "unchanged",
            "session": "unchanged",
            "next_id": "at-ceiling"
          }
        },
        {
          "actor": "application",
          "op": "rotate-signed-prekey",
          "inputs": {
            "store": "store-at-ceiling"
          },
          "expect": {
            "outcome": "ok"
          },
          "effect": {
            "prekey_store": "unchanged",
            "session": "unchanged",
            "next_id": "at-ceiling"
          }
        },
        {
          "actor": "application",
          "op": "rotate-kem",
          "inputs": {
            "store": "store-at-ceiling"
          },
          "expect": {
            "outcome": "ok"
          },
          "effect": {
            "prekey_store": "unchanged",
            "session": "unchanged",
            "next_id": "at-ceiling"
          }
        }
      ]
    },
    {
      "id": "establish-initiator-with-one-time-curve-prekey",
      "comment": "Family 2: initiator establishment with a one-time curve prekey (session-establishment.md, Sending the initial message).",
      "fixtures": {
        "bob-bundle-with-otpk": "Bob's published bundle, carrying a one-time curve prekey and a one-time KEM prekey"
      },
      "steps": [
        {
          "actor": "initiator",
          "op": "establish-initiator",
          "inputs": {
            "bundle": "bob-bundle-with-otpk",
            "peer_identity": "bob-identity"
          },
          "expect": {
            "outcome": "ok"
          },
          "effect": {
            "prekey_store": "unchanged",
            "session": "initiator-pending"
          }
        }
      ]
    },
    {
      "id": "establish-initiator-without-one-time-curve-prekey",
      "comment": "Family 2: initiator establishment against a bundle with no one-time curve prekey, the last-resort KEM path (session-establishment.md, Sending the initial message; Replay).",
      "fixtures": {
        "bob-bundle-no-otpk": "Bob's published bundle, with no one-time curve prekey and the last-resort KEM prekey named"
      },
      "steps": [
        {
          "actor": "initiator",
          "op": "establish-initiator",
          "inputs": {
            "bundle": "bob-bundle-no-otpk",
            "peer_identity": "bob-identity"
          },
          "expect": {
            "outcome": "ok"
          },
          "effect": {
            "prekey_store": "unchanged",
            "session": "initiator-pending"
          }
        }
      ]
    },
    {
      "id": "establish-responder-with-one-time-curve-prekey",
      "comment": "Family 2: responder establishment consumes exactly the named one-time curve and KEM prekeys, only once the initial ciphertext has authenticated (session-establishment.md, Receiving the initial message; key-deletion.md, Establishing a session).",
      "fixtures": {
        "bob-store": "Bob's prekey store, holding the one-time curve and KEM prekeys named below",
        "alice-initial-with-otpk": "Alice's initial message naming Bob's signed prekey, one one-time curve prekey and one one-time KEM prekey, whose ciphertext authenticates"
      },
      "steps": [
        {
          "actor": "responder",
          "op": "establish-responder",
          "inputs": {
            "store": "bob-store",
            "message": "alice-initial-with-otpk"
          },
          "expect": {
            "outcome": "ok"
          },
          "effect": {
            "prekey_store": "one-time-keys-deleted",
            "session": "responder-established",
            "one_time_curve": "deleted",
            "one_time_kem": "deleted"
          }
        }
      ]
    },
    {
      "id": "establish-responder-last-resort",
      "comment": "Family 2: responder establishment on the last-resort path -- no one-time curve prekey, the last-resort KEM prekey reused -- and the fingerprint is added only after the ciphertext authenticates (session-establishment.md, Replay, The replay identity).",
      "fixtures": {
        "bob-store": "Bob's prekey store, one-time curve and KEM pools exhausted, last-resort KEM prekey still live",
        "alice-initial-last-resort": "Alice's initial message naming no one-time curve prekey and Bob's last-resort KEM prekey, never seen before, whose ciphertext authenticates"
      },
      "steps": [
        {
          "actor": "responder",
          "op": "establish-responder",